comment,ip
剧情真的很好。 演员们的演的很真实。看了好感动。眼睛差点尿尿了。   源哥又 突破了一部电影。期待更多的电影。 期待王源和此沙更多的作品,江西
"🌟 推荐
剧情反转再反转让人意想不到特别好看
😊 演技
每个人演技都很好不会出戏
😭 哭点
特别多",浙江
值得去看！！,北京
平平无奇但是无言以对,山东
…真的真的不好看,福建
因为特惠票去看的，本身期待值不高，但是真的值回票价，电影节奏把控的很好，前面二十分钟我感觉都挺水因为买的中午的票看的想睡觉，但是后面变得很精彩刺激，而且因为本身就是打发时间才看的，有很多忽略的细节，后面去找了讲解，真的细节满满，推荐,无法获取
喜欢此沙饰演的江岳，就像韩寒老师说的不好演，需要有人物的厚度，此沙惊艳完成了！,上海
台词幼稚又尴尬，逻辑不清，剧情没深度，反转全靠遮遮掩掩。全程怼着王的脸拍特写，尬死了…,河北
"看完了电影，我感觉久久走不出来，泪失禁体质表示走在路上都要流眼泪，被影片感动是一部分，更多的是我为小源感到骄傲！我觉得他真的很棒！他真的很会演戏！他的演技丢在演艺圈也是上游的，如果你不信那就去看看孤星计划，看我说的是不是真的咯😎

我真很想推荐这部电影，我知道去年夏天小源拍这部电影很幸苦，特别热特别闷，毕竟是谍战片，受伤是免不了的，拍戏连拍十几个小时是免不了的，我知道一部电影需要很多人的幸苦付出。这还是小源主演的第一部电影，第一次要扛起票房这个艰巨的任务，孤星计划实在是穷，宣传大部分都是靠的王源粉丝，这么好的电影，我很想让所有知道的不知道的都了解到«孤星计划»，我永远100%相信王源，相信他选的剧本，相信他做的决定。王源不会让你失望！«孤星计划»也不会！

如果你都看到这里啦，你会愿意去看«孤星计划»吗？等它上线视频软件之后你会点进去看吗？要是问我的话，我还想再去电影院看一遍…",四川
剧情紧凑，扑朔迷离，反转再反转。小源的演技真的意料之外（比预期还精彩），各位主演的演技都精湛。孤星计划值得,江苏
我其实是又带着粉丝滤镜来看的。一切都挺好的，只是我觉得有很多剧情都没有处理的很好，尤其是看过官方的宣传视频，感觉有很多细节电影都没有很好的体现出来。但情节确实挺有看点挺刺激的，挺不错的。,江西
王源的演技值得你去观看这部电影！,山西
太好看了宝宝们快去看,江苏
演员阵容很棒 剧情也很喜欢 是今年比较喜欢的一部电影啦  也期待演员王源的下一部作品！,海南
"电影里每个人物刻画的都很细腻，演员的力度拿捏的很舒服，演员能让观众把自己代入到那个时代，我认为这是演戏最成功的地方了。
李一民最后的牺牲，眼睛里没有对死亡的恐惧。更多的是肯定，是对自己的，亦是对大家的。从自卑的小工人变成了孤星社不可缺少的一员，再到最后的牺
牲。他也不过才二十几岁。
谁懂最后响起的音乐，鸡皮旮瘩起来的同时眼泪也跟着哗哗掉画很喜欢里面的一句歌词“但别丢了，你的勇敢”送给每一位努力拼搏勇敢追梦的人",上海
好看又好吃，老板人也超好，还送了小礼物。,新疆
真好看呢 手机剩下10的⚡️,陕西
很热血，也有很多反转，推荐！,江苏
剧情不拖沓 情节环环紧扣 演员演技在线 很有代入感 是紧张热血的青春谍战片 我的爱国情怀又一次被点燃了,云南
唉，我觉得确实一般般吧，剧情有点乱，不知所云。,上海
好看！剧情节奏可以，一点也不会无聊，感觉王源这部演技很可以诶,云南
超级好看 尤其是最后李一民的那一幕 还以为主角不会死呢 然后就是在监狱那个眼神 还怪有实力的 演的不错 又震惊又疑惑的  还有就是这个片子反转反转加反转 看到最后天平是好的 主角团die了一个又一个（因为看了很多主角都是不会死的剧）已经推荐朋友去看了 也会二刷！,无法获取
超级好看啊，陪朋友看的，一开始完全没想到会有反转之类的，本来期待值不是很高的，但是超出意料的感觉，剧情，演员，画面都很好，非常值得。,山东
这电影看完了后，当时只是感觉还行，但没得怎么样精彩好看，,四川
狐星计划好看王源声张雪莹音声音好看电影好可以,陕西
明显看到王源演技有提升，￼本影片本身就致敬未成年的英雄拯救国家机密人员撤离的故事，在那个年代有多少人能活到成年，又有多少人在未成年的时候参与了很多不属于他年龄是断开承受的东西，现在的生活，都是￼￼祖祖辈辈辛辛苦苦打拼下来的，也是用多少未成年的孩子的心血挣来的！此片致敬￼￼￼那些我们的中国￼英雄，不分男女老少！！！￼,浙江
剧情很精彩全程高能，各位主演演技也很好，感受到了影片中各位青年热血的青春，每一代逐日移山的青年都有自己奋不顾身地热爱，每一份炽烈的热爱都值得被用心对待。,北京
好看 剧情跌宕起伏 很有氛围感 值得一看,湖北
"🌟 推荐超好看

😭 哭点3人组意难平

🥚 彩蛋反转超多",北京
王源的电影超好看！,陕西
剧情反转反转再反转 很精彩 主角没光环 这部电影真的很值得观看 反派在扮演中也很有实力 以为计划肯定完美无缺 但其实死亡就是一瞬间 没有人会在乎你是谁 原来李一民不是主角 李一民开着大卡车冲向敌人的时候也挨了枪 并不是那种有主角光环不会受伤 真正的主角是千千万万的学生 工人 各界爱国人士成功只是某一个结果，并不是我们追求的终极目标，最重要的是在过程中，你是否收获了你想要的东西。,云南
剧情一点都不拖沓，节奏紧密，看的人很爽，反转反转再反转，不错！,江苏
"超级棒！剧情紧凑，全员演技好，特别是一民，演技是真的不错！少年以勇气为舟，渡黑夜，向黎明。我们终将离开会这个世界，别丢了你的勇气。愿我们像泰戈尔诗中说的那样，生如夏花般绚烂，死如秋叶般静美。
孤星计划！爆！爆！爆！",江西
全片没有一帧多余，全程紧凑，环环相扣，反转很多，意料之外又在情理之中。全员演技在线，台词功底配合画面，超级沉浸式。非常好看！！,安徽
看电影的时候影片节奏刚刚好，非常好看，非常推非常推荐哦,广西
"好很感人呀！
🎉闪光点",广东
烂大街，花钱看他们两个演恋爱和独白，谍战片拍出爱情片,海南
看哭了好几次,江苏
人无法同时拥有青春和对青春的感受，趁年轻勇敢一次吧,福建
震撼！！！！,广西
主角没光环，反派智商演技双在线，没有任何剧情多余，剧情紧扣，一环扣一环环环相扣，一开始确实是奔着王源去看的，但是看到最后真的觉得很值得去看，其实我认为全剧没有主角又或是说全员主演，主演不是任何人，是当时所有的爱国群众，《孤星计划》爆爆爆，《孤星计划》票房大卖！！！,四川
太好看了 演员很鲜活 每个人都在拼了命的保护情报,山西
挺好看的谍战片，王源演技不错，很惊喜,海南
"good！good！good！很好！特别好！有很多反转有刀子 演员导演都很好 一部很值得去细品的电影 
🌟 推荐 大家的演技都有在成长 王源张雪迎梁靖康等等的演技都好 真心推荐！很值得！就不剧透了希望《孤星计划》能大爆！也希望看《孤星计划》的你能够勇敢！不要丢了自己的勇敢！大家都勇敢一次！",广东
影片讲述了一群无名但热血的青年学生，共赴一场明知不可为而为之的绝密任务，突破重重围剿，合力完成了一场极限撤离行动。在成长与蜕变的过程中，他们一往无前向光而行，留下一段不可磨灭的生命轨迹。,天津
剧情悬疑点设置较合理，是一种新的革命片的形式,无法获取
剧情老套。而且都是年轻的演员，一点也压不住场。尤其是男主和女主在整个故事中不断的含情脉脉，一点也没有革命战争片子的内容激怀壮烈的感觉。而且在演绎的对话过程中，就像是演戏而没有真正的那种现场的感觉。配音也是听起来特别像是录音棚的效果。简直就像是凑合。其次再说一下拍摄也不知道用的是2k还是什么？在摄像机镜头移动的过程中重影。嗯，这个片儿说起来就是有点儿太假拼凑的感觉。不值得看。,安徽
也就是勉强合格的水平，首先描述青年人在革命中贡献力量的题材不错，但是本剧的青年演员演技还有相当大差距， 没有能够塑造一个丰满的人物形象，并且演技不太贴近生活，有些“尬”，其次，有反转但是并没有意料之外的惊喜，电影看一半就基本上预测了结局，所有线索的铺垫没有能够一步一步逐渐接近真相，而是在第一个线索出现时就基本上可以全盘推测出线索设置的目的和后续剧情发展。,江苏
还不错，反转挺大,陕西
避坑就得了 看一顿没看明白  对象非拉着看王源的  结果真没什么意思,河北
很好看的电影,安徽
超级好看的电影,河南
好看的！源源哥哥演得好！！,甘肃
一民超棒👍🏻,广西
"🌟 推荐
好看看哭了",广西壮族
太好看了，很振奋人心。剧情也跌宕起伏，反转的很有创意。几位主演都演的很好。片尾曲一响，我都想哭了🥲,浙江
超好看！有开头有结尾，我喜欢这种叙事方式！！！而且其中剧情也很连贯正常！！！非常值得观看的一部影片！,河北
推荐!!!一直就想去看的，这次终于找到机会去看了，真的真的很好看。一开始是冲着王源去的，但是最后吸引我，打动我的却是电影的情节。这部电影给我最大的感触就是:我们虽然很渺小，但是只要我们愿意，就会有无穷大的力量，我们每个人都有自己的使命要去完成，我们不能选择自己的过去 但是我们可以选择自己的未来，我们的未来一定是一片光明，我们生在和平的年代，有着美好的明天，在这一切的基础上，我们最应该感谢一批又一批革命者为此的付出。电影《孤星计划》真的很推荐!!!希望我们都能像李一民一样做最真实的自己，足够勇敢！！！,陕西
碟中谍中谍，真的非常好看👀,江苏
电影是好电影，剧情也不错，就是王源撑不起这部电影，尬得能抠出三室一厅😓,四川
好看！！！   李一民值得 王源值得,江苏
很好看！反转很多，看到后面特别精彩,湖北
很好看，看到了热血青年为国抛头颅洒热血的精神，每一个演员都是独一无二的，每一的青年人也都是昂扬斗志的，,浙江
孤星计划确实不错，值得大家去电影院看看，感受青春热血爱国片，了解五卅运动和白色恐怖那段历史,江苏
电影好看 可是看电影的人 真是没素质！ 麻烦那曲万达影院的工作人员注意一下 有些来看电影的（抽烟的抽烟 大声叫的 大声打电话 真是无语！ 特别是抽烟 麻烦工作人员一定来看电影的人声明清楚 看电影的注意事项！,西藏
超级超级好看 剧情一直在反转 所有演员演技到位,江苏
很好看，剧情根本猜不到后面会发生什么,上海
好看好看，源源很棒,无法获取
孤星计划，太好看了！,海南
特别好的作品！！！,无法获取
"🌟 推荐
超级好看的悬疑片",河南
剧情很不错，描写了一群年轻人为了老师的任务而努力奋斗，演技很不错，认真的看完会很感动,重庆
"😊 演技。
《孤星计划》这部电影存在的意义就是让我们牢
记历史和一民一样有爱国意识。
演员演技都在线
大家可以尝试去看",广西
很好看，推荐,重庆
真的很不错的 全员演技在线 王源真的震惊到我了 感觉看电影的时候一直想的都是李一民 反转也还意想不到,广东
很好看，最后很感动,陕西
剧情超级起伏，反转，反转，演技超好，我爱群像,四川
非常好看，王源演的李一民很不错,江西
演员王源也超级棒！,江西
王源的演技让我大为震惊比我想象中的好,江西
一个女生看，也是不害怕的。看感觉还不错啊，比较喜欢这种题材的电影,广东
"评《孤星计划》：黑暗中的人性曙光

《孤星计划》无疑是一部令人瞩目的佳作，从开篇便紧紧抓住观众的心，直至落幕仍余韵悠长。

影片的叙事手法精巧绝伦。其节奏把控张弛有度，情节推进有条不紊，层层伏笔在不经意间铺设，又在关键时刻引爆，给人以强烈的观影冲击。故事并非平铺直叙，而是在回忆与现实的交织中逐渐清晰，让观众跟随主角一同抽丝剥茧般探寻真相，沉浸感十足。

人物塑造堪称一绝。主角们形象丰满、性格鲜明，他们的挣扎与抉择、脆弱与坚强皆刻画入微。面对绝境，人性的复杂被展现得淋漓尽致：有自私自利的盘算，更有舍生取义的崇高；有恐惧绝望的泪水，亦有勇往直前的坚毅。这些生动鲜活的角色在荧幕上熠熠生辉，让观众仿若置身于他们的世界，感同身受其喜怒哀乐。

视觉效果方面，《孤星计划》更是震撼人心。从灰暗冷峻的色调营造出的紧张氛围，到枪火纷飞、爆炸轰鸣的惊险场景，无一不让人血脉贲张。细节之处更是精雕细琢，破旧的建筑、角色脸上的伤痕与污渍，皆增添了影片的真实感与厚重感，使整个画面仿若历史的重现。

影片内涵深刻而富有层次。它不仅仅是一部简单的动作片，更蕴含着对人性、道德、正义与牺牲的深度思考。在孤星计划这场残酷的",北京
愿我们生如夏花之绚烂，死如秋叶之静美,广东
很多反转，很直得看,广东
"无敌好看
超乎意料",江苏
很棒 源源的演技太棒了,海南
"在黑暗中窥见希望光芒
在破晓时静待晨光初现
​《孤星计划》李一民💚",浙江
两个演技最难评的人来演，损失票钱,浙江
超好看 。。。,河南
一般．没什么看头．不够刺激．悬念．演员演技水平一般．还没有老片好看．7分好评,上海
很难看，真的，也就易烊千玺拿得出手！,云南
挺好看的，值得去看看,上海
好看！！！！,广东
"《孤星计划》，一部很出乎意料的电影，即使知道结局是成功了但是依然提心吊胆的看完了过程。
     很多细节并没有想象中那么套路，总感觉不会牺牲的角色转眼就牺牲了，剧情的节奏非常快，确实是反转很多，一直沉浸式观影，一直在猜测到底谁才是好人，很多伏笔和细节，细细品味完让我还想二刷一次
  
《孤星计划》值得一看。",江西
趁年轻勇敢一次吧 很热血,云南
反转反转再反转，很热血很好看,四川
一般，爱国中掺着爱情或者友情,安徽
期待王源 非常好的作品继续支持,湖北
很好，好看，热血沸腾,广西
演员实力都非常在线，电影讲述的故事非常还原，,贵州
✨一部视觉与灵魂的盛宴🚀,重庆
很棒，每个演员演技都很好,甘肃
非常非常值得看！,湖北
一民   好心疼 呜呜呜  ,广东
源哥的进步好大，影片以1927年的上海为背景，讲述了一群青年临危受命执行绝密护送任务的故事，情节跌宕起伏，充满了紧张刺激的谍战元素和生死考验，如李一民在护送途中遭遇重重困难与危机，始终扣人心弦.,云南
很好看 很有意义的电影,广西
精彩内容不容错过，值得观看,山东
超好看的，王源演技超好👍,广东
故事情节很好，演员演技不错,云南
生死与共，患难相扶。超级无敌热血的群像片，每个人的演技都很在线，到最后的反转很热泪盈眶,广西
"深刻的感受到了那个年代革命前辈们的不易。全员演技在线！
另外，恭喜我的男主角！演员王源，未来可期！
🌟 推荐",四川
剧情反转在反转,广东
反转反转再反转，特别让我惊喜，结尾主题曲一出来泪流满面，值得多刷的一部好电影,重庆
很好看爱国片推荐，演员各个方面演技都很好，到后面还有点小感人，生于华夏真的很幸福,浙江
也就那样吧，没什么新意,河南
"好看
🌟 推荐
非常满意，王源的演技也不错，非常的优秀，也很棒",广东
"非常值得去看，非常棒的一个影片
🌟 推荐",无法获取
超级好看 王源也演的超级好 期待更多的剧,湖南
非常感人，很好吃，很喜欢,黑龙江
是二刷了，懂了第一次没看懂的细节。剧情真的没话说，环环相扣，没有一处是多余的。演员演技也都很不错，反派的反转惊到我了。还有一些光影的运用，很神。总之是部不错的片子。,安徽
电影感觉就好像是营救了一个老头，可能是我感悟不够深，不过怎么说是一个好电影,浙江
剧是个正剧，除了男女主在演偶像剧，其他演员演技都在线。,浙江
"真的很好看啊，每个人的演技都在线，都让人沉浸，电影中光线也暗示了许多，细节很多，不断的反转，紧凑的情节，最后真的没忍住哭了，真的是很好的电影啊，如果主演不是王源应该会有很多很多的人看吧 。“王源""成就了他也阻碍了他。致敬先辈，敬他们的勇敢无畏，冷静智慧",四川
真的很好看！极力推荐大家去看！非常热血！,安徽
抛开对王源的粉丝滤镜 他真的演的超级好😭电影剧情很抓人心 大反转超级过瘾。看了还想在看！！,上海
尬，无话可说,黑龙江
电影整体很好看，大家演技都很好，剧情跌宕起伏，反转反转再反转，李一民太好哭了，王源演技棒棒！！！,江西
呜呜呜真的很好看！！在电影院默默为一民落泪😢结尾的煽情部分刚刚好 推荐推荐！！王源演技也进步很多！继续加油吧！！,福建
王源贼棒，感动到了,内蒙古
超级好看，反转反转再反转！！看得我急死了，非常有代入感，很棒,江西
值得推荐是蛮好看的,湖南
剧情反转很多 看的我热血沸腾的 ！！！,四川
好看的！结局太感动了🥹,陕西
看完之后真的很难受，这部电影从很久之前就一直在期待了，看完之后真的没有让我失望，每个人的演技都很好都很在线，和我以往看的同类型的电影不一样，超多反转，一直在替他们紧张，看得我也是心惊胆战的，电影的群像我真的很爱，每一分孤星社的成员都好棒，尤其是一起抵抗然后唱歌那一段，看得我起鸡皮疙瘩，超爱群像群像就是yyds，孤星计划你们真的拍的很好，给每一个人点赞,四川
好看的，全员演技在线,湖北
很好看，很令我惊喜的一部电影！整体剧情衔接很紧凑，反转再反转，每个人拼尽全力去完成这个看似不可能的任务，真的超级精彩！全程让人特别有代入感！到后面主题曲一响起来眼泪就控制不住了，每个人的人物形象都很丰满，大家的同学情谊，爱国热情，青春热血都让人特别感动，非常值得一看的电影！,江西
剧情很燃 碟中谍 不断反转 主演也非常棒 演出了那股热血,广西
纯粹为了想看一部好电影去看的，结果，一点也不好看，剧情太牵强了，演技也是……😅😅不推荐看。追星的话当我没说,广东
好看！！！！,湖北
"超级好看
😊 演技",内蒙古
李一民超级棒，《孤星计划》超好看！！！,贵州
"说实话我不怎么喜欢看这类电影，完全是冲王源去的，但是抛开粉丝滤镜来说真的好看，剧情反转再反转好多镜头都特别震撼，每位演员演的都很好。
多说一句电影中场的时候我旁边有人在打电话真的挺影响心情的😅",江西
真的很好看啊，剧情反转又反转的,无法获取
剧情精彩刺激让人意想不到，主创团队演技很好，让人共情，孤星计划大爆,河南
剧情紧凑，群像很少见这种结局，很不错如果时间再长一点就更好了😄,山东
超级好看 反转真的没想到,湖北
非常好看，推荐一下,浙江
孤星计划实在是太好看了，都去看,云南
好好看，剧情反转再反转，没有一个镜头是多余的,河北
太好看了，王源演技yyds！,湖北
很好的一个电影，让大家感受到历史,江苏
真的很好看，推荐大家都去看看,安徽
好看，不站在粉丝的立场上都是很好看的程度，推荐大家都来看,江苏
这个反转我真没想到，而且看着忍不住就哭了T﹏T,河南
非常热血的一部片子，讲述了有志青年们为了祖国的革命而奉献自己，演员们的演技也在线，后期反转令人意想不到！非常推荐,浙江
《孤星计划》所传达的主题与价值观也是值得称赞的。电影通过讲述一个关于勇气、信念和爱的故事，让观众深刻感受到了人性的光辉。同时，电影也呼吁人们关注社会问题，传递了正能量和积极的生活态度。,四川
故事情节不错，王源演技有待提高,上海
超好看的电影,四川
"🌟 推荐
特别好看 剧情反转反转再反转 红色电影就是会让人热泪盈眶啊🥹值得N刷",上海
好看好看，很喜欢💕,山东
"真的非常非常好看，代入感很强，剧情发展很紧凑要和人物一起动脑才能跟上的那种感觉
🌟 推荐",广西
挺好看的，值得看看,河南
很热血的青春谍战片！,广东
很好看 激情满满,无法获取
好看，反转多，节奏快,江苏
演员的演技都很好，剧情热血，反转再反转，结局谁是卧底太精采了，,四川
评分刷出来的？,山东
"🌟 推荐
这部影片背后的历史是从来没有被翻拍过的 演员演技都有非常大的进步 发挥的都非常好 剧情较为紧凑 反转反转 再反转 非常推荐大家去看",湖南
全程反转哦哦,黑龙江
全程高能刺激，反转反转再反转,河北
结尾让人意想不到 反转再反转 好看 感觉有很多细节 ,上海
青年演员Roywang未来可期 ,广东
一般，不是很好看,陕西
看的挺好，就是电影院有点冷,陕西
一进门真的是惊艳到了，环境特别不错，是周围环境最好的了，性价比非常高很适合周末和朋友们一起来呀，度过一个快乐周末！也推荐大家来呀我愿给到五星🌟，因为布景非常用心，太太太棒了！，真的超级好看！！！给我看哭了，不是那种有主角光环的电影！！！真的超级推荐！！！,湖南
最后一幕有种上海堡垒的既视感,辽宁
好看。。。。,甘肃
特别紧张刺激，全程反转反转再反转，电影结束了我和我朋友还在意犹未尽,广西
感觉演技一般，故事情节有点拘谨！,江苏
好看的，值得推荐,安徽
豆瓣开分5.9说明了一切，,吉林
爱国热血青春🥹剧情有反转🥹很好看,江苏
“星星之火，可以燎原。”因为有了每一位孤星社成员的不懈努力和坚持，才能发挥出巨大的力量。其中令我印象最深的还是李一民这个角色，虽然他只是个无依无靠的孤儿，在汽修厂当学徒，尽管在如此艰苦的条件之下，他仍然没有放弃自己对于学习的渴望和对于爱国的决心，毅然决然地加入了孤星社，并且坚定执行任务，保卫祖国，守护着自己的朋友和同志。他的真诚、勇敢、坚定和舍生取义的精神，无不令人感动。王源的原声台词也很好，很容易让人代入到当时的情景之中，很适合“一民”这个角色，看得出他在演好这个角色上下的决心和功夫。片尾曲《别丢了你的勇敢》一响起，真是让人热泪盈眶。最后引用一句歌词——“藏在众多孤星之中还是找得到你”，希望《孤星计划》大卖，这部电影值得被大家看到！,上海
非常好看的电影啊王源演得很好很不错非常贴合剧情拉了两个一起去看她们都说这是一部非常精彩的电影对于剧情结局也是让我出乎意料电影里的一民所展现出来的旧中国新青年的形象令我印象推荐推荐！！！！,广西
故事题材不错,广东
好看！剧情跌宕起伏，悬疑不断,重庆
"非常好看！剧情反转再反转，完全被带入其中，跟着一起紧张！
😊 演技

🎉闪光点

🌅 画面",上海
王源演技不错 ,安徽
＃孤星计划，反转又反转，让人沉浸其中，特别有意思，看到了大家一起并肩作战，，很热血，推荐大家来观看《孤星计划》,河南
真少年，看的孩子热血沸腾，潜移默化的影响着孩子对革命先人的敬佩和理解。孩子在成长的过程中，需要掌握很多方面的知识，技能，但也需要很多有营养的精神价值来唤醒孩子们的内心和判断。在对的时间看到这样一部对的电影🎬，真心希望孩子心中有那样一把可以燃烧的火焰。,河北
